Title,Rating,Review,Date
5.0 out of 5 starsMind blowing!!!,5.0,"I recently got my hands on the Samsung S24, and after spending some quality time with it, here's my detailed review:**Camera Performance:**In daylight, the camera performs exceptionally well, capturing vivid and detailed shots. The colors pop, and the images are sharp, making it a delight for photography enthusiasts. However, during low-light conditions, there's noticeable noise in the photos. Nevertheless, I'm optimistic that Samsung will address this issue with future updates.**Battery Life:**Contrary to some complaints about the battery, I found it to be quite impressive. With the amazing battery optimization feature tucked away in the settings, I easily managed to squeeze out 8-9 hours of screen time. It's important to note that heavy users might experience faster drain, but for moderate usage, the battery life is commendable.**Heat Management:**One drawback I noticed was the device heating up with prolonged usage. While it's not a dealbreaker, I do hope Samsung addresses this issue in subsequent updates to ensure a smoother user experience, especially during intensive tasks.**AI Features:**The AI features on the Samsung S24 are a standout. The AI editor allows for creative freedom, enabling users to produce stunning photos effortlessly. Whether it's enhancing colors or adding artistic effects, the AI capabilities truly shine, elevating the overall photography experience.**Overall Impression:**Despite a few minor quirks, the Samsung S24 is undoubtedly a must-buy phone. Its exceptional camera performance in daylight, coupled with impressive battery life (thanks to optimization features) and innovative AI capabilities, make it a solid choice for anyone in the market for a reliable smartphone. With potential updates on the horizon to address concerns like low-light photography and heat management, the Samsung S24 is poised to be a top contender in the smartphone market.",Reviewed in India on 19 April 2024
4.0 out of 5 starsSo far so good.....,4.0,"I'm using this phone for last 3 weeks. Good phone.  Not sure about gaming as I don't play games on phones.  Otherwise,  it's a good phone to handle day-to-day needs. Yes it heats, but doesn't over heat. Heat gets easly dispersed aswell.  One ui is awesome! Good camera. Overall it's a good phone.",Reviewed in India on 2 November 2024
4.0 out of 5 starsLove ❤️,4.0,This was my deep desire to have it and specially amber yellow edition. Amazon helped me to get at best value and with ease and with all required accessories ✨️.  Love my phone and using it with no single issue. Very true product.  Applaud to Amazon,Reviewed in India on 9 November 2024
5.0 out of 5 starsBest android phone under 51k,5.0,"Using from last 2 month, the camera is excellent and the samsung display is best.",Reviewed in India on 3 April 2025
"4.0 out of 5 starsBattery, Heat",4.0,"Everything with the Phone is alright except the battery, it drains so fast even if I am not using the phone. And also the phone heats after a short use of phone..",Reviewed in India on 21 November 2024
5.0 out of 5 starsTitle: Powerful Upgrade with Stunning Display an Solid Battery Life!,5.0,"I've been using the Samsung Galaxy S24 for a few weeks now, and I'm genuinely impressed! The display is stunning, with vibrant colors and smooth scrolling that make watching videos or browsing a real treat. The phone's performance is top-notch; it handles apps, games, and multitasking with ease, thanks to the new processor.Battery life has been solid, easily lasting me a full day on moderate usage. The camera setup is impressive too, especially in low-light conditions. The photos are clear, detailed, and very vibrant. However, the zoom quality could still use some improvement.One thing to note is that while the design is sleek and modern, it feels a bit similar to previous models. For users upgrading from older devices, it's a great choice, but those with recent models might find the difference subtle. Overall, it’s a powerful, feature-rich phone that offers fantastic value!",Reviewed in India on 6 October 2024
5.0 out of 5 starsNo more fear of online purchase,5.0,Great phone though size was little set back ..it's tuny comparatively. But I had lot of apprehensions buying it online and this seller has proven it wrong. Happy with this online purchase...!!,Reviewed in India on 17 March 2025
"4.0 out of 5 starsCompact size , Everything cool apart from battery",4.0,"Premium look is the USP. It does slips as it has glass back and smooth edges. No scratches or dents even after falling multiple times (minor, head/pocket height).Every flagship features check the box (refresh rate, fluid ux, camera, sound, navigation, size)",Reviewed in India on 1 November 2024
5.0 out of 5 starsPremium mobile experience,5.0,"This phone has everything which makes it a premium flagship device.Seller: INDIAN LIBERTYFeedback: Seller is good and sent me a brand new sealed pack mobile.Samsung Galaxy S24Pros:1. Camera takes good photographs.2. stereo sound quality is loud and clear.3. seamless migration from the old device.4. Smooth user experience of Samsung One UI.5. Awesome AI features for search and media editing.6. Compact form factor and premium looks.7. All day battery back up on Adaptive display (120 htz) on moderate usage. Keeping it on 60 htz will last longer for obvious reason. I used this device during a recent trip and it gave me all day back up. I was continuosly on roaming data, used maps for long hours, took hundreds of photos and captured few short videos, used for making contactless payments, used multiple apps at the same time and much more. I had a seamless experience with no hiccups at all. With 30w charger it takes around 1hr to fully charge. Within 15mins it can charge upto 25-30% approx.Cons:1. I found my LG G8x Thinq has a better display quality but this is just a personal experience.2. Phone gets warm (not hot) when multi tasking is done. So it is with most of the devices.3. Screen size feels little smaller when you shift from a bigger screen size.4. You have to purchase super fast charging adapter, earbuds separately which will cost you around 2-3k.",Reviewed in India on 25 April 2024
4.0 out of 5 starsUnderrated flagship phone,4.0,"Really enjoyed using it over the last week. Other than the speakers, I haven't found any other issue with the phone. The weight is perfect, battery life is quite good, comfortable to hold and overall for the price it's a great deal.",Reviewed in India on 25 October 2024
"3.0 out of 5 starsDecent device, unfortunately ruined by Exynos",3.0,"Decent device, unfortunately ruined by Exynos",Reviewed in India on 26 February 2025
5.0 out of 5 starsMobile phones,5.0,Amazon provide very good product,Reviewed in India on 9 April 2025
5.0 out of 5 starsBest product.,5.0,Good Product.  I bought in 56k.All are good accept battery life.,Reviewed in India on 29 March 2025
"2.0 out of 5 starsNot new, wrong processor, misleading listing",2.0,"Received the phone with a worn-out box, no SIM ejector pin, and signs the screen protector had already been removed. Got it checked at a Samsung service centre — it was activated 24 days before delivery. Also, the listing said Snapdragon, but the phone came with an Exynos. Definitely not what I expected from a new product.",Reviewed in India on 21 April 2025
3.0 out of 5 starsNot satisfied as expected,3.0,"There are heating issues.Face and finger unlocking is slow and sometimes does not workOnly benefits than iphones - non pros models is that it is AI enabled phone.Dk nkt think that Camera is like a proper cameras... i think, it is not as expected as it is high segmentOtherwise no problem with delivery and phoneStill, with above issues, you want to buy this phone, buy it from samsung shop application because they give other benifits with samsung watch and other accessories. I saw later after buying, so cant reverse the decision.But if you st",Reviewed in India on 18 October 2024
5.0 out of 5 stars👍Good Performance and Camera 🤩🤩,5.0,"I purchased this mobile from Amazon on release date. Initially the camera clarity with over saturation was observed and battery backup was noticed poor. After April 2024 update, samsung fixed those issues. I have uploaded the screenshot for battery which lasts up to 7 hours. Camera quality and shutter speed also improved. Any issues, the samsung will update positively within short time.Pros:☆ Samsung promised 7 OS updates upto Android 21.☆ Build quality is nice.☆ Camera quality has been improved. Front camera is awesome.☆ Battery backup is good☆ Sound quality is good with stereo speakers☆ No lag when handling any apps.☆ Samsung Exynos processor performs nice. No heating issues.☆ Data transfer by USB 3.2 is awesome.Cons:¤ This phone uses LPTO AMOLED display technology. The colour reproduction and quality is much poorer than Super AMOLED. Display quality will disappoint you.¤ I have enabled Touch Sensitivity in settings eventhough the finger unlock struggles after fixing screen guard.¤ Still the camera needs to be improved especially 50MP shows nice image in display. After capturing,  it adds contrast  towards black making it poor.Hope future update may resolve this issue.Overall this is high performance and nice built quality. Thank you Amazon for fast delivery.",Reviewed in India on 30 March 2024
4.0 out of 5 starsOne of best,4.0,"Best camera best AI. Just one drawback, low battery performance.",Reviewed in India on 29 November 2024
2.0 out of 5 starsLow battery life,2.0,Battery life is low. It gets discharged quickly - within 10 hours after full charge. This is very unusual for a brand new phone.,Reviewed in India on 19 May 2025
4.0 out of 5 starsExynos is Good,4.0,Samsung is only option for a person who don't like Chinese phones. Pixel service center not reachable for us. Exynos 2400 is very fast and responsive for me as I don't play games. I get very good battery backup for a full day usage. I like the one Hand phones only and beside flagship you don't find any these days. Display is very good. Touch I'd works like charm. Sound output is also very good and loud. So overall it's a phone for handy likes and moderate users. Price should be less about 65-70k ( that's why 1 star less),Reviewed in India on 6 March 2024
4.0 out of 5 starsBest mobile,4.0,In this price s24 is best performance  mobile but something  heating issue happened whenever  environment  temperature  going up. Otherwise  mobile and camera  battery  screen touch fingerprint  all are best.,Reviewed in India on 20 September 2024
5.0 out of 5 starslowest price and next day delivery,5.0,genuine product. lowest price and next day delivery. only amazon can do this.phone was sealed pack and not used or activated. go for this without having second thought.Amber yellow looks very elegant and phone works like a charm. bought this phone along with TheGiftKart transparent back case and along with OpenTech Smartphone Tempered Glass Screen Protector. my first experience of purchasing phone online and totally loved it. thank you amazon.,Reviewed in India on 12 December 2024
5.0 out of 5 starsGood,5.0,Good,Reviewed in India on 25 March 2025
2.0 out of 5 starsHeating Issue,2.0,Heating up too much .... suggest not to buy. I am trying to return - the seller is not allowing return -BEWARE,Reviewed in India on 29 April 2025
4.0 out of 5 starsCamera is very improve...,4.0,Camera quality is very good  performance best But the phone is getting heated very quickly and the battery is also draining very quickly,Reviewed in India on 8 October 2024
4.0 out of 5 starsBest phone you can get. It only has heating problem,4.0,"Best phone you can get. It only has heating problem. Sometimes even normal app usage also causes phone to heat up a little.Rest if you are looking for best camera, best user experience, best screen, best design (even though this is copied 🙃) this phone is the best.",Reviewed in India on 2 August 2024
3.0 out of 5 starsCompact and smooth device with poor battery life and frequent heating,3.0,"The device can easily be used with one hand. The display is quite bright. 120hz  adaptive refresh rate works really well. The phone can heat up during initial setup. The cameras are good for clicking sharp vivid pictures, it doesn't do a great job in capturing moving subjects. The battery life is not great, can only get about 4-5hrs screen on time at the end of the day. These issues are primarily because of the small form factor. If you are willing to look past these issues then it is one of the best options you can go for. Do consider pixel 9 of you want an android alternative.",Reviewed in India on 17 July 2024
3.0 out of 5 starsReview after 6months of usage,3.0,"Looks, quality, sound, performance, network quality, and battery backup are great for day-to-day use.Heating issues: while charging, camera use for 5-10 minutes of use.One UI is not optimized properly; it has too many bugs, like the camera color shifting with respect to background lights in an abnormal way sometimes.Charging takes more time than it shows, e.g., 1 hour 20 minutes. After 20 minutes, it's been like 1 hour 5-10 minutes. So, fake charging timing.After the August security patch, I got a single black line. 😭",Reviewed in India on 24 August 2024
1.0 out of 5 starsPRODUCT RECIVED WITH SOME ISSUES,1.0,"I HAVE RECIVED THE PRODUCT. THANK YOU FOR THE PRODUCT, BUT THERE IS A GLITCH. WHEN I OPENED THE BOX OF A BRAND NEW SAMSUNG GALAXY S24 AI THE PRODUCTS FLIP WHICH IS ATTACHED ON THE PHONE SCREEN IS ALREADY PULLED OFF AND ATACHED TO THE CHARGING CABLE CASE. THIS IS SO WEARED EXPERIENCE, IT SEEMS THE PRODUCT IS ALREADY SOLD TO SOME ONE BEFORE ME AND IT GOT RETURNED AND SOLD AGAIN TO ME.IAM EXPECTING SOME DISCOUNT ON THIS CASE. KINDLY TAKE THIS AS AN IMPORTANT NOTE.",Reviewed in India on 16 June 2025
1.0 out of 5 starsVery very nice product,1.0,"I ordered a smartphone from Amazon, but they sent me a open seal, damaged product.When I contacted customer care, they asked me to accept the box and use it.I questioned *why I should accept an opened sealed box when I've paid the full amount.*After multiple emails and phone calls, they acknowledged their mistake and initiated the return process.However, my first EMI of approximately ₹8,000 was deducted from my bank account, which they haven't refunded yet.Apart from all thats24 performance is good, Samsung is good company, charging speed is ok if you are using samsung charger sound quality is also good touch function is good if you are using it without temper galss or quality tamper glass on itOriginal Samsung s24 is value for money.Be aware of the Chinese variant of Samsung s24",Reviewed in India on 25 May 2025
5.0 out of 5 starsSafe Delivery of Product,5.0,Beyond Expected,Reviewed in India on 6 March 2025
5.0 out of 5 starsExcellent: Didn’t expect that Exynos would perform so well.,5.0,It’s a good one. Battery backup is good. It’s on par with my iphone 14’s battery backup. It’s fast and smooth. App openings are fast. Good ram management.It feels a little warm when using the camera but that also happens with my iPhone.,Reviewed in India on 28 December 2024
4.0 out of 5 starsGood phone for photography lovers,4.0,,Reviewed in India on 30 October 2024
5.0 out of 5 starsAmazing,5.0,Ohh this phone is amazing. I loved it. Just camera is different from 24 ultra but I wanted smaller in size so got this.,Reviewed in India on 25 January 2025
4.0 out of 5 starsLove the phone,4.0,"It is a small light weight phone andresembles iPhone in appearance. I am a low to moderate user. So, battery is not a major problem till now. But at times it heats up really badly. Then battery also drains out fast. It gets heated up most while taking pictures. That's the sad part. Otherwise performance wise it is quite good.",Reviewed in India on 8 May 2024
5.0 out of 5 starsGood purchase!,5.0,"I got the phone at a decent price, and after comparing with S23 Ultra. The phone is decent sized, and fits well in Jeans pockets and in my palm... unlike my old S22 Ultra (most of the times, we don't need the tablet features - with stylus). Although, only thing it misses is the optical zoom features from it's counterpart Ultra version..",Reviewed in India on 10 November 2024
"4.0 out of 5 starsNice choice, handy phone.",4.0,,Reviewed in India on 28 October 2024
5.0 out of 5 starsAfter 3 months of use,5.0,Premium Build quality 👌I have Cobalt Violet colour with 256gb of storage 💯This colour looks fantastic 😍Excellent disply and camera quality 📸If you're going to shoot UHD or 8k videos Go for Higher Storage variants like 256 Gb or 512 Gb storage models 🎥📸Battery life is excellent 🔋Phone can easily last a full day with 5 to 6 hrs of screen on time 📱⏰With 25w charger phone charges to 80% within 30 mins 🗣️💡Performance is also really great 💯Overall a great product by Samsung 💯👍 #SamsungGoals #TechReviews,Reviewed in India on 31 July 2024
4.0 out of 5 starsAfter using 10 days,4.0,"If you gonna switch from iPhone to this, then surely you gonna feel lil bit disappointment. Screen action is slow than iPhone. The speaker quality gonna feel you bad. Battery is not that much satisfactory. It's quite similar to other average android phone. Look is giving tough competition to iPhone.",Reviewed in India on 6 May 2024
3.0 out of 5 starsGreat phone with a great flaw,3.0,"The phone excels in all the fields i.e Looks great, amazing software, practical AI features, great camera.But it has one major flaw that is battery life, on a full 100% charge, I can only get 3 hours of screen on time, that too when I don't use my phone for heavy features like gaming or camera.Also, on hit afternoons the phone get warm (you can feel it in your pocket )which leads to more battery drainage.I hope Samsung can fix these battery related issues and make the phone best in it's class.",Reviewed in India on 11 April 2024
1.0 out of 5 starsUSED PRODUCT RECEIVED,1.0,"Used item received, battery also in very bad condition overall im say about this worthless product received by seller.....",Reviewed in India on 26 June 2025
4.0 out of 5 starsWorth for money,4.0,This mobile is really good for usage. And the camera quality is just awesome. Mobile is handy and really worth for the price,Reviewed in India on 14 June 2025
4.0 out of 5 starsVery good,4.0,One of the best phone,Reviewed in India on 27 October 2024
5.0 out of 5 starsExynos 2400 is good,5.0,"Before buying another exynos S series I was in doubt but exynos 2400 exceeded my expectations I haven't notice heating issue just noticed phone getting warmer on top part when used extensively under direct sunlight but that's normal for any AMOLED displayAbout the display, it's very very bright under direct sunlight screen looks like you are viewing inside a room or soBattery life is excellent I'm using wifi and 5g battery easily lasts for 1 and half day even 2 daysOther samsung s24 features are goodGalaxy AI is very good makes everything exciting especially if you are into photo video editing and circle to search is very fastCameras are best bulit quality is top notchI recommend s24 to anyone who wants compact flagship",Reviewed in India on 28 February 2024
4.0 out of 5 starsHeating issue,4.0,"Good purchase if you buy it under 60,000. Exynos 2400 is not worth 75,000. Also the phone has some heating issues when used extensively. Rest everything is very good.",Reviewed in India on 24 July 2024
3.0 out of 5 starsHeating issue,3.0,"I bought today samsung s24, mobile was quitgood but only one issue is there is heating if u using 10 to 15 minutes it will get heat. This is the nagetive of this phone.",Reviewed in India on 8 October 2024
1.0 out of 5 starsDon't buy mobile on Amazon,1.0,"Pathetic delivery service. Do not buy any mobile on Amazon, there are serious concern with quality of the mobile. Heating issue, short battery life and overall appalling customer service.",Reviewed in India on 17 June 2025
5.0 out of 5 starsSimple and Superb,5.0,"I'm not a big time gamer or depend heavily on social media at all.I am just a normal user who banks on the phone just to make calls, text and sometimes surf the internet.The color is good and the interface is awesome.The cameras look modest but work mighty.The battery works decent for me and goes on for about 22-30 hrs on a single charge cos my saver is usually on.The Galaxy AI blows your mind off with what all it can do.The phone is compact, easily fits in the pocket and turns heads when you pull it out.I believe I have the best smartphone over coz it is sober and sophisticated.",Reviewed in India on 29 February 2024
1.0 out of 5 starsNever buy this Overheating 4g only Exynos lagging phone. It's no longer like S23 with Snapdragon,1.0,"Unable to do livestreams because of frequnet excessive overheating and 4g network switch from 5g because of itI bought this samsung galaxy s24 base 256gb only for building my youtube carrier and spent nearly ₹80,000/- but this phone have exynos unlike the old s24 which had snapdragon. After just few months price dropped so much that it's crazy. 50 to 60k for this now.I have never bought anything of such high price, i saved for this phone for 10+ years of saving money and my disappointment is immeasurable.My phone is overheating and lagging too much when playing genshin impact.When i play any game or do livestream my phone overheats and the 5g connection disconnects, and it switches to 4 g, which is not unlimited.This issue can't be fixed as samsung is ignorant enough to first cheap out on hardware and software and then call every issue i tell as a ""feature not a bug""They say to ""just reset every time"" which still does not fix.I want my hard earned money back as this is the biggest scam ever to me, i should have bought a computer instead. No snapdragon on s24 now. Cheap. Slow 25w charging takes more than 1 hour and heats your phone until it's fully cooked. I'm cooked aswell. It's also uncomfortable to hold and way too small to type on using both thumbs. Small screen makes you bring closer the phone bending your neck.",Reviewed in India on 10 October 2024
3.0 out of 5 starsAverage Flagship,3.0,"Not satisfied at all if this product is to be considered Flagship.... Heats up quite a bit... Display not up to the mark.... and most disastrous is the camera.... If you click in auto mode, with AI support, you will get some amazing outputs but if you put things in manual mode you will click some worst picture of your life with poorest colour reproduction....and the last is the battery which drains out like nothing",Reviewed in India on 4 May 2024
5.0 out of 5 starsS 24 review,5.0,It's so cute that it dolby atmos feels like cinema and it's battery life is 1day and weight is very  less and function properly and charge 1 hour and value for money,Reviewed in India on 21 November 2024
5.0 out of 5 starsCompact Flagship phone,5.0,Fast and snappy phoneCamera - 4/5Design - 5/5Battery - 4/5Display - 5/5I have used iphone15 and xiaomi 14 as well but S24 is on next level specially with display quality and UI experience.Battery peformance is very good as it gives around 6-6.5 hrs SOT on full charge which is excellent for compact phone. I have attached screenshot as well.,Reviewed in India on 3 August 2024
3.0 out of 5 starsNot worth it,3.0,"After using midrange android phones for many years, I upgraded to Google Pixel phones three years ago and decided to upgrade further to Galaxy S series. Primarily, I wanted a small screen phone. Frankly, I don't feel anything premium. Apps are crashing in this phone also. This phone doesn't even stand the games in Google Pay.",Reviewed in India on 27 June 2024
5.0 out of 5 starsGood,5.0,Good,Reviewed in India on 3 February 2025
"4.0 out of 5 starsNice product , value for money",4.0,"Battery life is good, photo clarity is excellent, sound quality is good",Reviewed in India on 10 August 2024
5.0 out of 5 starsPerfect camera phone,5.0,Of you really are not a gamer.. go for samsung s series ..,Reviewed in India on 8 January 2025
3.0 out of 5 starsGood display and performance,3.0,Battery backup is not good.Minor heating issue in normal usage also.,Reviewed in India on 11 October 2024
2.0 out of 5 starsI am not happy with S24 piece.,2.0,During video calls the phone gets heated up.Finger lines recognition on the phone is cumbersome.Selfie with light is not proper. When I click  with flash entire phone display becomes brighter. Something wrong.,Reviewed in India on 2 February 2025
5.0 out of 5 starsAmazing Product,5.0,The media could not be loaded.The product samsung S24 in yellow gold colour looking so beautiful and sleek. It's features are marvelous.Rest will get to know after using the product,Reviewed in India on 10 January 2025
3.0 out of 5 starsPls don't buy,3.0,Heat issues and battery life is very bad,Reviewed in India on 26 October 2024
5.0 out of 5 starsSamsung s 24,5.0,Very nice product thanks Amazon,Reviewed in India on 10 January 2025
