Title,Rating,Review,Date
"5.0 out of 5 starsNot flagship material,..but now I think it is!",5.0,"This is an updated review :So just moved from S20, which I had for so many years to the new S24. The phone itself is good, everything works fine.. but that's expected. Got the Golden yellow colour and thankfully it's not as flashy as shown in the photos.. this is more of a light cream colour which gives a slight golden shine when seen at particular angles. It's a very decent looking phone.When you use it, the first thing you  notice is that this phone really heats up. It's Samsungs flagship and the heating issue is not limited to just while charging it, even when you use it normally.. the back gets hot. Never faced this with the S20. I feel like am using some cheap Chinese phone...well it won't burn your ear, but yes it's hot enough for one to take note.>>And now after a few more days of usage, the heating issue has disappeared. Even after hours of continuous use it doesn't heat up... not sure what happened.. perhaps some software update.Second is the design. Samsung used to have it's own design team which came up with really innovative stuff.. now they are just copying the iPhone. It literally looks like a Chinese knock off, OK let's give them credit.. it looks like a cheap Korean knock off of the iPhone. Nothing wrong with that, except that if you want to copy then copy something good. Personally the flat edged design is terrible to grasp and feels rigid in the palm. The earlier curved edge ones were so much comfortable to hold. Now you have to hold on to this flat metal frame which heats up.. it's not a pleasant experience. Perhaps they made this for cold weather countries, so you get an inbuilt palm heater with your phone. A phone that keeps your hands warm while in the cold... heaven knows what the designers were thinking!>> Well as I said before the heating issue has gone. As for the shape, I would say it's easier to handle having those flat edges.. it rests easily on the figers while typing etc.. but still you do feel the flat edges when the phone is in your pocket etc.. So the shape is a mixed bag verdict. Personally I prefer smoother edges.The battery drains out fast aswell..  currently it's matching the drainage speed of my old Samsung. Basically you have to have a fast charger around.>> This is the point why I actually decided to edit the review. The phone's software literally optmises battery usage. It continuously adjusts screen brightness levels.. and with time and use, it's getting better at optimising battery performance. For regular usage, with a few hrs of videos and few hrs of games.. it's pulling through the day quiet easily.Honestly I don't know why this phone should cost so much.. for the issues it has, you should easily get a similar cheaper phone in the 20-25k range.>> Doubt it, this phone keeps getting better with usage. Never expected or experienced that before.Camera haven't yet used. My old S20 used to give some amazing results and have used it a lot with manual settings aswell. Wonder if the S24 will be better there.I think I might switch back to the S20.>> Camera still not used to potential. Basic shots are very crisp though.The AI functions are also quiet handy. Just played around till now.. so hopefully like the other aspects will get better with time.🤞",Reviewed in India on 17 May 2024
5.0 out of 5 starsAn amazing compact phone - The Exynos2400 is very good with no issues as with the previous chipsets.,5.0,"I have been using this phone for a month now and the Samsung Galaxy S24 is a very good phone. If you are someone who is looking to buy a phone in this price range then you probably have the Iphone 15, Pixel 8 series as an alternative option but I would say the Samsung phone experience is the best of the three unless you are into the Apple ecosystem or you want to buy and IPhone cuz it's an IPhone (It's just crazy that many people make decisions like that 😂).Jokes apart, I would say at this price this is probably the best phone in terms of the display, software experience and overall features. The performance is also very good, there are many people who are skeptical about the Exynos chips which is obviously unfair from Samsung to have two versions of the same phone but at least this time the chip is very good and almost as powerful as the SD 8 Gen 3. Yes it is 10-15% less powerful in the CPU department from benchmarks but honestly theses flagship chipsets are so powerful that 90% of the people are not even going to notice the slight difference. I tried playing COD on this phone at max possible settings for 1 hour and the phone was hot but not any more hot than any other phone would get. Yes it did drop the battery which I will get to later but I don't think raw performance is an issue with the Exynos chips this time as the Exynos chips is actually more powerful that the SD 8 Gen 3 in the GPU department. Now coming to the battery this is the only place I am a little disappointed with this phone like if you are a light user who only uses their phone for calls, messages, music on bluetooth you can make the phone work for an entire day but if you are a medium or a heavy user like if you play games, take pictures, videos etc you will definetly drain the battery before the end of the day. In my experience I am a fairly heavy user using bluetooth, mobile hotspot, playing a few light games I always need to charge the phone at around 5 pm. But this is a sacrifice you have to make if you are getting a small phone, now if you are thinking that the IPhone 15 is also a small phone but it has better battery life then that is because the IPhone 15 only has a 60hz display which isen't as smooth the 120hz on all the phones these days and also does not consume a lot of battery like a 120hz display would. I am not that big of a camera bluff so I won't talk about it just want to say that it is a good camera with sharp pictures with good looking colors and camera features (Checkout the images attached). The video is also very good.Overall, the Samsung Galaxy S24 emerges as an impressive smartphone, overshadowing debates about Exynos chip performance differences. Its overall performance, combined with its compact size, makes it a compelling choice for users seeking a premium smartphone experience.",Reviewed in India on 10 March 2024
4.0 out of 5 starsMy true feelings about this phone 😃,4.0,"Everything is on point as expected. But there are 1 or 2 things i want to share.1. Metal edges are little bit on sharp side so without cover it is difficult to use.2. If you live in warm area, it really gets hot and i found frame skips, but that was one time in 1 year of use.3. Battery backup : Screen on time is about 4-4:30 hrs, sometimes feels low sometimes okay. So take your powerbank with you everytime you go out.Other than these this phone is a beauty.That's my review after 1 year of usage. 🫡",Reviewed in India on 9 June 2025
5.0 out of 5 starsgood purchase,5.0,"Small and fast, perfect!",Reviewed in India on 30 June 2025
1.0 out of 5 starsDo not buy,1.0,"The model doesnt feel upgraded in any manner, the fingerprint sensor doesnt work well, face recognition is not supported for most applications, camera is not as great as the reviews are mentioned . Overall a very disappointing experience, will be returning it.Value for money:Waste of moneyCamera quality:Is disgustingly low.Charging speed:Phone is heating up in just minutes of using itFingerprint sensor:the fingerprint sensor doesnt work well, face recognition is not supported for most applications,Why did you pick this product vs others?:Biggest mistake relying on the youtube reviews",Reviewed in India on 30 June 2025
5.0 out of 5 starsFeel so comfortable,5.0,,Reviewed in India on 29 June 2025
5.0 out of 5 starsWat,5.0,Good,Reviewed in India on 27 June 2025
3.0 out of 5 starsThis is not worth it,3.0,"This phone is glitching on WhatsApp keyboard and when it gets hot it becomes like this, I am using it by putting hot water in it.I am not even able to talk on call, the heater gets switched off in a short time, I am having the biggest problem with this.",Reviewed in India on 28 June 2025
4.0 out of 5 starsProcessor,4.0,That is very good phone but if it comes with snapdragon processor will more better,Reviewed in India on 27 June 2025
4.0 out of 5 starsGood,4.0,Excellent,Reviewed in India on 30 June 2025
4.0 out of 5 starsquality,4.0,Why did you pick this product vs others?:not used to samsung UI. getting used to it,Reviewed in India on 23 June 2025
4.0 out of 5 starsPhotos and display.,4.0,"S24 is simply superb.  High quality photos, display extordinaary. Battery required 5000mah. But it only 4000mah. Overall it is too good.  5/5.",Reviewed in India on 27 May 2025
4.0 out of 5 starsSheerly beautiful with but with it's limitations,4.0,"Update (04th August) :Reducing one star this time.Now using it after 15 days, certainly there are some limitations in this phone. Albeit they can be addressed. First is phone started to heat up on very basic operations in first one week, later on it gradually got under control. It's still not 100% cool while doing basic stuff such as browsing, playing music. But not as much as it was in first week. Maybe battery is taking time to recalibrate.Second is battery performance. This is where it gets tricky and requires a patience and experiments. Over a all last two I have done changes in setting where with same usage pattern battery can literally vary from 5hrs screen on time to 7hrs sot. This can get frustrating to figure out.Phones default settings out of factory might provide somewhere around 5-5:30hra sot. If you need more then you need to tweak the settings a lot like - putting apps to deep sleep, turning google search app off, turning off adaptive battery protection, turning off Customization services or using it for very specific apps. (I use it for routines and modes only where while charging only it turns on adaptive battery protection.) these settings tweaks and experiments I managed to get 6:30-7hrs of screen on time. Phone with such a premium price shouldn't require user to perform such analysis to get best out of it.Third is camera : I am still not 100% convinced that this can take better pictures in all scenarios. In low light I have observed it's hit or miss. Images are soft in low light. Maybe software update need to fix this. Other than this under normal light condition camera works at reasonably respectable quality.--------‐-----------------------------------------------Coming from using ios for last 6 years, this is altogether different and enriching experience. The size in palm of your hand feels so beautiful that in incomparable to anything else in terms of ease of using the phone. There had been hell of debate over snapdragon vs exonys, and quite valid biases towards exynos considering it's poor legacy. But this time it looks like Samsung have almost nailed it. Haven't though tested with heavyweight games but day to day experience has been hyper smooth and quite a respectable battery of almost 7 hours of screen time. Battery charging takes a time at 25w max but it was never an issue for users like me. I am not in rush. Sound quality is great, camera looks decent though its too early to compare with iPhone picture quality, it produces reasonably well lit well exposed images. Overall fully worth the price.Would be updating this review again after few months of usage.",Reviewed in India on 23 July 2024
3.0 out of 5 starsExynos instead of Snapdragon is a cheating,3.0,Eventhough in the description its shown its having Snapdragon but Its not having Snapdragon its Exynos and the battery life is very low.Even after the updates its the same.I bought this thinking it contains SD🤧,Reviewed in India on 24 June 2025
3.0 out of 5 starsHeat issue,3.0,"Heat issue is there which is major ,apart from this phone is good .",Reviewed in India on 24 June 2025
4.0 out of 5 starsOverall it delivers very good value for money,4.0,Very nice phone. Battery life and slow charging is a bit of issue in Samsung. On hand feeling is quiet good. Handy phone having nice UI support. Compared to iphone 15 or 16 It is value for money.,Reviewed in India on 15 April 2025
5.0 out of 5 starsBest Compact Phone At this Price,5.0,Great value for money at this price point,Reviewed in India on 20 June 2025
3.0 out of 5 starsS24 size is smaller than S22,3.0,Not better than S22 . Smaller size .,Reviewed in India on 11 June 2025
4.0 out of 5 starsOnly con is heat,4.0,"Got a good original product, no scam , only cons of this phone is its heats a lot",Reviewed in India on 6 April 2025
5.0 out of 5 starsNice,5.0,Mobile is very nice,Reviewed in India on 25 June 2025
5.0 out of 5 starsGood,5.0,Good product,Reviewed in India on 14 June 2025
5.0 out of 5 starsSamsung s24,5.0,"Product so good but, Delivery system so bad",Reviewed in India on 6 June 2025
"4.0 out of 5 starsGreat Display & Performance, But Battery Life Needs Work",4.0,"The Samsung Galaxy S24 is a solid smartphone with a lot to offer, but there are a few areas where it falls short. Here's a breakdown of its key features:Battery: The battery life on the S24 is decent, but not great. You can expect to get through ~5 hours on a single charge with moderate use, but standby time is poor. This means the battery drains even when you're not using the phone.Camera: The camera system on the S24 is good, but not exceptional. It takes good photos in most lighting conditions, but it doesn't quite match up to the best camera phones on the market.Display: The display on the S24 is excellent. It's bright, clear, and has a high refresh rate for smooth scrolling.Heat Management: The S24 tends to heat up more than expected, even during basic tasks like browsing the web. This becomes a bigger issue when using the camera, where it can get quite hot even after short recording sessions or charging your phone.OS: The S24 comes with Android 14 with lot of improvement, but expecting to receive an update to Android 15 at the earliest (Even Nothing 2a has received it)Other Considerations:Design: The S24 has a sleek and stylish design that's comfortable to hold.Performance: The S24 is a powerful phone that can handle even the most demanding tasks (not gaming)Software: Samsung's One UI software offers a variety of features and customization options.Overall, the Samsung Galaxy S24 is a good phone with a lot to offer, but the battery life and heat management issues hold it back from being great. If you're looking for a phone with a great camera and excellent display, the S24 is a good option. However, if battery life and heat management are important to you, you may want to consider another phone.",Reviewed in India on 30 May 2024
3.0 out of 5 starsThere is battery issu,3.0,Need larger battery size according to os,Reviewed in India on 14 May 2025
"5.0 out of 5 starsGood phone, overall, Exynos is improving",5.0,Good phoneOver-all good improvement on Exynos optimizationI get around a 6 to 7 hrs of screen on time with the continuous usage,Reviewed in India on 15 May 2025
5.0 out of 5 starsNice one,5.0,Nice product bought for my father he was really happy,Reviewed in India on 22 May 2025
2.0 out of 5 starsPhone is in good condition but is not a great buy,2.0,"Have been using Oneplus 6t for about 5 years after which I switched to Samsung s24. I was expecting a lot more advancements but the phone was a disappointment. Mainly due to it's battery life, reboot time, night camera, face unlock and fingerprint scanner which in my opinion is below average from its price point.The processing speed is average, sound quality is average. I'm a minimal user and yet I feel the battery life is terrible. Especially when it's on low battery the phone drains out in minutes. Cannot capture a good selfie in the night even when the phone is on a stand.I do like the new AI features but I would rather prefer to have the basic functionality to be better. As for the AI features,  you can choose to delete an object from the photo you took but can't choose to insert an object you want. Instead, you can choose the object you want to alter, and run the AI tool hoping that it understands what you want.A cool feature I was interested in was the inbuilt language translator, however, I realised later that only a limited number of international languages are available for use. All in all, it would be better to get a chatgpt subscription rather than buy this phone for it's AI features.The charger was another disappointment.  The phone does not come with a charger but only a charging cable. This phone would take upto 5 hours to charge on a regular dash charger so I had to buy a specific 45w charger from samsung. The charging cable looked very feeble, and not so surprisingly, broke within 2 months of usage.I usually have loved all my phone purchases and this was the first phone I regret buying. I miss my oneplus 6t and I do consider giving up this phone in exchange for a new oneplus or an iphone. I wish Amazon India had a return option for phones like they provide in the USA.Edit: I tried to exchange this phone for the new oneplus or iphone but the s24 128gb 8gb is not accepted for exchange all across the amazon app. Now I'm stuck with this thing.",Reviewed in India on 8 November 2024
4.0 out of 5 starsS23 vs S24 Exynos,4.0,"If you're torn between the Samsung Galaxy S23 Qualcomm version and the S24 Exynos version, I've got some insights that might help you decide.I've had my hands on both, and here's the deal: the S24's screen is a total eye-catcher, outshining the S23's already impressive display. The build has a more premium vibe, though the S23 isn't far behind in quality.The game-changer for me was Samsung's 7-year promise for OS and security updates on the S24 – that's longevity right there! While the Exynos 2400 might boast higher benchmarks than the Snapdragon 8 Gen 2, in everyday use, it's pretty much neck and neck.Now, my wife's S23 stays cool as a cucumber, but my S24? Gets a tad warm during updates – nothing alarming, though. And battery life? Identical twins!So, who should snag the S24 Exynos? If you're all about future-proofing with those sweet updates, it's your match. Otherwise, the S23 still rocks and comes with a friendlier price tag. If you want to game, then you should not buy this, and I will suggest to buy a bigger phone for better cooling and bigger screen.And hey, if you're comparing it to the iPhone 15 base model – the S24 Exynos has got it beat. Wishing we had the Qualcomm version here in India, but hey, Samsung's catching up fast in the processor race.",Reviewed in India on 15 March 2024
3.0 out of 5 starsAverage,3.0,"In this cost , camera is average if you compare with i phone . Battery is not more then 1 day. Touch is smooth.. but will explore more before buying this",Reviewed in India on 9 April 2025
5.0 out of 5 starsAmazing Device,5.0,"The design is sleek and modern, with a durable glass back and metal frame, giving it a premium feel. Samsung has retained the stunning Dynamic AMOLED 2X display, which supports a 120Hz refresh rate for smooth scrolling and an immersive visual experience. The display is bright and vibrant, offering excellent color accuracy and HDR10+ support, which is perfect for media consumption.The camera system on the Galaxy S24 is one of its standout features. It boasts a versatile triple-lens setup with improved low-light performance, thanks to its upgraded main sensor and enhanced image processing. The zoom capabilities have also been refined, making the phone an excellent choice for mobile photography enthusiasts. The portrait mode, night shots, and video stabilization are impressive, competing with the best in the market.Battery life is solid, with a capacity around 4,900mAh that should comfortably last through a day of moderate to heavy use. Samsung's fast charging, wireless charging, and reverse wireless charging are also present, though the absence of a charger in the box may be disappointing for some. The phone also runs the latest version of Android with Samsung's One UI, which adds useful features and a clean user interface.5G connectivity, water and dust resistance (IP68), and robust security features like the in-display fingerprint sensor and facial recognition round out the Galaxy S24's feature set. However, the price point remains high, which might make it a better option for those willing to invest in a premium flagship phone.Overall, the Galaxy S24 delivers a fantastic all-around experience with top-of-the-line hardware, impressive cameras, and a beautiful display. It’s a great choice for anyone looking for a high-performance smartphone, though its steep price might give some pause.",Reviewed in India on 23 October 2024
5.0 out of 5 starsMohammed Shahzad,5.0,"Very good phone, good feeling in hand",Reviewed in India on 13 May 2025
4.0 out of 5 starsValue for money,4.0,"Superb phone, value for money. Only bettery need to improve. Only normal uses it can last upto 1 day but on heavy uses need to charge twice also.",Reviewed in India on 29 January 2025
4.0 out of 5 starsUser interface: 4.5/5  Display: 5/5  Camera: 5/5  Performance: 4.5/5  Battery: 4/5,4.0,"Everyone has written the complete review of this phone so I am not covering details again. Just want to focus on only one aspect i.e. this is a premium segment phone no doubt but the battery needs to tuned for serious. It drains like anything. It is understandable that because of the screen and the refresh rate battery life is less but these are premium parts of this phone and you cannot avoid to use a higher refresh rate screen. This is because as per the chipset used, it is highly essential to improve the efficiency.Other then that this is a fantastic phone where it can beat IPhone 15 series and Google Pixel 8 series in many aspects.The display is amazing, performance is also very smooth, and the camera is the master asset in this phone. Trust me you won't find a telephoto lens in any of the base variants of premium segment phone(neither iphone nor google pixel)except Samsung. But again if you want a phone for high class security and privacy then i phone is better.",Reviewed in India on 20 July 2024
5.0 out of 5 starsUnbeatable !!,5.0,Camera AmazingDisplay AmazingEverything Amazing !!,Reviewed in India on 10 May 2025
4.0 out of 5 starsGood phone,4.0,"This phone is made for those who want small and handy mobile in pocket and don't want big and heavy phones that require both hands to operate. Camera quality is one of the best I've seen in any mobile this justifying the flagship phone tag. Just one complaint though - during setup of phone, don't know how the paint got removed near power button.I guess if someone wants to buy, buy metallic colour - golden or silver, to avoid such problem.",Reviewed in India on 7 December 2024
4.0 out of 5 starsA good phone,4.0,Battery life could be better. Camera is the winner here. Color balancing is something very strong.Samsung Ui makes the experience better.,Reviewed in India on 29 January 2025
4.0 out of 5 starsOver all performance is awsome,4.0,But I'm facing heating issues even though I'm not using it much..beware of that .,Reviewed in India on 26 January 2025
5.0 out of 5 starsIts a good mobile Phone,5.0,"I HAVE WAITED FOR 6 MONTH TO SHARE THIS FEEDBACK.1. NO lag in performance,  no hang or freeze while running heavy application.2. Using as a developer phone, connection with android studio smooth and easy and feasible to debug.3. Camera quality is great and AI feature is an extended support for photo shoot lovers you won't feel bad.4. AI application present are awesome and performs as expected.5. Battery backup is good inspite of using extensively.6. Speaker is great, and loudspeaker selection while call its awesome.Guys i didn't fine any cons in this mobile till now,  and buy this mobile you will love it.",Reviewed in India on 3 February 2025
3.0 out of 5 starsWASTE OF MONEY,3.0,Not a good product .It lags again and again while using any social media app,Reviewed in India on 9 March 2025
5.0 out of 5 starsGreat phone amazing performance,5.0,"I shifted back to samsung after a long time, and chose S24. The phone is amazing to have and performs well in day to day tasks.Camera is great with AI enhancement.AI is well integrated in the phone delivering many features.Performance wise it can play any heavy game.Sound is amazing with speakers at both sides.No issues with the exynos chipset.Superb Screen, clear and visible in outdoors.As its a compact device there are some minor heating issue.Charging is decent. Takes around 1-1:30 hours to get fully charged.Battery lasts a day with normal usage(scrolling through social media, OTT and videos playback, browsing the internet)With heavy usage you might have to charge it frequently or get a better option of s24+To conclude, if you need a compact device do prefer s24 as it will be getting regular updates as well as the phone is amazing to hold and great with the specifications.",Reviewed in India on 12 November 2024
